DATE ADDED TO CATALOG	PUBMEDID	FIRST AUTHOR	DATE	JOURNAL	LINK	STUDY	DISEASE/TRAIT	INITIAL SAMPLE SIZE	REPLICATION SAMPLE SIZE	REGION	CHR_ID	CHR_POS	REPORTED GENE(S)	MAPPED_GENE	UPSTREAM_GENE_ID	DOWNSTREAM_GENE_ID	SNP_GENE_IDS	UPSTREAM_GENE_DISTANCE	DOWNSTREAM_GENE_DISTANCE	STRONGEST SNP-RISK ALLELE	SNPS	MERGED	SNP_ID_CURRENT	CONTEXT	INTERGENIC	RISK ALLELE FREQUENCY	P-VALUE	PVALUE_MLOG	P-VALUE (TEXT)	OR or BETA	95% CI (TEXT)	PLATFORM [SNPS PASSING QC]	CNV	MAPPED_TRAIT	MAPPED_TRAIT_URI	STUDY ACCESSION	GENOTYPING TECHNOLOGY
2013-11-20	23720494	Evans DM	2013-05-29	Hum Mol Genet	www.ncbi.nlm.nih.gov/pubmed/23720494	Genome-wide association study identifies loci affecting blood copper, selenium and zinc.	Blood trace element (Se levels)	5477 European ancestry individuals	NA	2q35	2	215995827	MREG	MREG			ENSG00000118242			rs3770549-?	rs3770549	0	3770549	intron_variant	0	NR	3E-6	5.522878745280337		0.161	[0.092-0.230] unit increase	Illumina [> 2500000] (imputed)	N	serum selenium amount	http://purl.obolibrary.org/obo/OBA_2050059	GCST002039	Genome-wide genotyping array
2021-03-30	32778093	He B	2020-08-10	BMC Biol	www.ncbi.nlm.nih.gov/pubmed/32778093	Genome-wide pQTL analysis of protein expression regulatory networks in the human liver.	Protein quantitative trait loci (liver)	172 European ancestry individuals, 29 Black individuals, 86 individuals	NA	2q35	2	215945889	NR	MREG			ENSG00000118242			rs74371935-T	rs74371935	0	74371935	intron_variant	0	0.1045	2E-8	7.698970004336019	(IGHM)	0.08698	NR unit increase	Illumina [1671387] (imputed)	N	protein measurement	http://www.ebi.ac.uk/efo/EFO_0004747	GCST011427	Genome-wide genotyping array
2019-01-28	30535121	Gao XR	2018-12-07	Hum Mol Genet	www.ncbi.nlm.nih.gov/pubmed/30535121	Genome-wide association analyses identify 139 loci associated with macular thickness in the UK Biobank cohort.	Macular thickness	59,814 European ancestry individuals	8,609 European ancestry individuals	2q35	2	215962191	MREG	MREG			ENSG00000118242			rs200857348-?	rs200857348	0	200857348	intron_variant	0	NR	5E-10	9.301029995663981		0.981	[0.65-1.31] unit increase	Affymetrix [11100000] (imputed)	N	macula attribute	http://purl.obolibrary.org/obo/OBA_2045216	GCST006976	Genome-wide genotyping array
2025-09-25	40650424	Julian TH	2025-07-01	Pigment Cell Melanoma Res	www.ncbi.nlm.nih.gov/pubmed/40650424	Pigmentation and Retinal Pigment Epithelium Thickness: A Study of the Phenotypic and Genotypic Relationships Between Ocular and Extraocular Pigmented Tissues.	Left eye overall retinal pigment epithelium thickness	29,550 European ancestry individuals	NA	2q35	2	215960244		MREG			ENSG00000118242			rs3770526-T	rs3770526	0	3770526	intron_variant	0	NR	3E-16	15.522878745280337		0.11	unit increase	Affymetrix [1691495] (imputed)	N	retinal layer thickness	http://purl.obolibrary.org/obo/OBA_2050110	GCST90672032	Genome-wide genotyping array
2023-05-11	36848389	Currant H	2023-02-27	PLoS Genet	www.ncbi.nlm.nih.gov/pubmed/36848389	Sub-cellular level resolution of common genetic variation in the photoreceptor layer identifies continuum between rare disease and common variation.	Photoreceptor cell layer thickness phenotypes (MTAG)	31,135 European ancestry individuals	NA	2q35	2	215957474		MREG			ENSG00000118242			rs3755152-G	rs3755152	0	3755152	intron_variant	0	0.89	4E-10	9.397940008672037		0.31	[0.21-0.41] unit decrease	NR [9745601] (imputed)	N	photoreceptor cell layer thickness measurement	http://www.ebi.ac.uk/efo/EFO_0803370	GCST90255614	Genome-wide genotyping array
2023-05-11	36848389	Currant H	2023-02-27	PLoS Genet	www.ncbi.nlm.nih.gov/pubmed/36848389	Sub-cellular level resolution of common genetic variation in the photoreceptor layer identifies continuum between rare disease and common variation.	Photoreceptor cell layer thickness phenotypes (MTAG)	31,135 European ancestry individuals	NA	2q35	2	215986221		MREG			ENSG00000118242			rs148388367-A	rs148388367	0	148388367	intron_variant	0	0.04	1E-21	21.0		1.3	[1.03-1.57] unit decrease	NR [9745601] (imputed)	N	photoreceptor cell layer thickness measurement	http://www.ebi.ac.uk/efo/EFO_0803370	GCST90255614	Genome-wide genotyping array
2025-11-17	40721530	Polikowsky HG	2025-07-28	Nat Genet	www.ncbi.nlm.nih.gov/pubmed/40721530	Large-scale genome-wide analyses of stuttering.	Stuttering	38,257 European ancestry male cases, 336,022 European ancestry male controls	NA	2q35	2	215968233		MREG			ENSG00000118242			rs73988065-T	rs73988065	0	73988065	intron_variant	0	2.5E-4	5E-6	5.301029995663981		1.11175	[0.67-1.55] unit increase	NR [29409446] (imputed)	N	Stuttering	http://purl.obolibrary.org/obo/HP_0025268	GCST90707227	Genome-wide genotyping array
2009-07-24	19581569	Treutlein J	2009-07-01	Arch Gen Psychiatry	www.ncbi.nlm.nih.gov/pubmed/19581569	Genome-wide association study of alcohol dependence.	Alcohol dependence	476 European ancestry cases, 1,358 European ancestry controls	1,024 European ancestry cases, 996 European ancestry controls	2q35	2	216033935	PECR	MREG, PECR			ENSG00000118242, ENSG00000115425			rs7590720-G	rs7590720	0	7590720	regulatory_region_variant	0	0.29	1E-8	8.0		1.35	[1.22-1.49]	Illumina [524396]	N	alcohol dependence	http://purl.obolibrary.org/obo/MONDO_0007079	GCST000432	Genome-wide genotyping array
2011-11-18	22004471	Frank J	2011-10-18	Addict Biol	www.ncbi.nlm.nih.gov/pubmed/22004471	Genome-wide significant association between alcohol dependence and a variant in the ADH gene cluster.	Alcohol dependence	1,333 European ancestry male cases, 2,168 European ancestry male controls	NA	2q35	2	216028914	NR	MREG, PECR			ENSG00000118242, ENSG00000115425			rs1344694-?	rs1344694	0	1344694	intergenic_variant	0	NR	5E-6	5.301029995663981		1.27	[1.15-1.41]	Illumina [463044]	N	alcohol dependence	http://purl.obolibrary.org/obo/MONDO_0007079	GCST001281	Genome-wide genotyping array
2022-11-14	35347128	Yin X	2022-03-28	Nat Commun	www.ncbi.nlm.nih.gov/pubmed/35347128	Genome-wide association studies of metabolites in Finnish men identify disease-relevant loci.	X-17654 levels	6,136 Finnish ancestry individuals	NA	2q35	2	216020025		PECR, MREG			ENSG00000115425, ENSG00000118242			rs2372683-A	rs2372683	0	2372683	intergenic_variant	0	NR	1E-50	50.0		0.54	unit increase	NR [16000000] (imputed)	N	X-17654 measurement	http://www.ebi.ac.uk/efo/EFO_0800784	GCST90140492	Genome-wide genotyping array, Genome-wide sequencing, Exome-wide sequencing
2022-09-28	34282934	Fan W	2021-07-20	mSystems	www.ncbi.nlm.nih.gov/pubmed/34282934	Association between Human Genetic Variants and the Vaginal Bacteriome of Pregnant Women.	Vaginal microbiome MetaCyc pathway (P562-PWY|myo-inositol degradation I)	315 Chinese ancestry individuals	NA	2q35	2	216012615		MREG, PECR			ENSG00000118242, ENSG00000115425			rs764932-A	rs764932	0	764932	intron_variant	0	NR	4E-6	5.3979400086720375		0.3066	[0.18-0.43] unit increase	Illumina [492582]	N	vaginal microbiome measurement	http://www.ebi.ac.uk/efo/EFO_0011013	GCST90026774	Genome-wide genotyping array
2023-02-27	36662838	Slomian D	2023-01-20	PLoS One	www.ncbi.nlm.nih.gov/pubmed/36662838	Better safe than sorry-Whole-genome sequencing indicates that missense variants are significant in susceptibility to COVID-19.	Resistance to COVID-19 infection (Exposed negative vs positive)	306 resistant cases, up to 770 benign, mild or severe controls	NA	2q35	2	215999618		PECR, MREG			ENSG00000115425, ENSG00000118242			rs1344698-?	rs1344698	0	1344698	intron_variant	0	NR	1E-7	7.0				Illumina [15489173]	N	COVID-19	http://purl.obolibrary.org/obo/MONDO_0100096	GCST90255358	Genome-wide sequencing
2024-02-15	36635386	Chen Y	2023-01-12	Nat Genet	www.ncbi.nlm.nih.gov/pubmed/36635386	Genomic atlas of the plasma metabolome prioritizes metabolites implicated in human diseases.	3-methylglutarylcarnitine (2) levels	8,220 European ancestry individuals	NA	2q35	2	216030213		PECR, MREG			ENSG00000115425, ENSG00000118242			rs7592559-C	rs7592559	0	7592559	intergenic_variant	0	0.0993668	2E-21	20.69897000433602		0.229236	[0.18-0.28] unit decrease	Affymetrix [15430292] (imputed)	N	3-methylglutarylcarnitine (2) measurement	http://www.ebi.ac.uk/efo/EFO_0800074	GCST90199971	Genome-wide genotyping array
2020-07-28	32450446	Wang H	2020-04-29	Neurobiol Aging	www.ncbi.nlm.nih.gov/pubmed/32450446	Genome-wide interaction analysis of pathological hallmarks in Alzheimer's disease.	Total PHF-tau (SNP x SNP interaction)	1,285 individuals	NA	11q22.3 x 2q35	11 x 2	103571566 x 215982428	NR x NR	PDGFDDN x MREG						rs11225878-? x rs3770542-?	rs11225878 x rs3770542	0		intergenic_variant x intron_variant		NR	9E-9	8.045757490560675				Affymetrix, Illumina [279409] (imputed)	N	PHF-tau measurement	http://www.ebi.ac.uk/efo/EFO_0010750	GCST010340	Genome-wide genotyping array
