DATE ADDED TO CATALOG	PUBMEDID	FIRST AUTHOR	DATE	JOURNAL	LINK	STUDY	DISEASE/TRAIT	INITIAL SAMPLE SIZE	REPLICATION SAMPLE SIZE	REGION	CHR_ID	CHR_POS	REPORTED GENE(S)	MAPPED_GENE	UPSTREAM_GENE_ID	DOWNSTREAM_GENE_ID	SNP_GENE_IDS	UPSTREAM_GENE_DISTANCE	DOWNSTREAM_GENE_DISTANCE	STRONGEST SNP-RISK ALLELE	SNPS	MERGED	SNP_ID_CURRENT	CONTEXT	INTERGENIC	RISK ALLELE FREQUENCY	P-VALUE	PVALUE_MLOG	P-VALUE (TEXT)	OR or BETA	95% CI (TEXT)	PLATFORM [SNPS PASSING QC]	CNV	MAPPED_TRAIT	MAPPED_TRAIT_URI	STUDY ACCESSION	GENOTYPING TECHNOLOGY
2020-10-23	32665545	van der Meer D	2020-07-14	Nat Commun	www.ncbi.nlm.nih.gov/pubmed/32665545	Understanding the genetic determinants of the brain with MOSTest.	Brain morphology (MOSTest)	26,502 European ancestry individuals	NA	12q13.12	12	49128822	DHH, LMBR1L, TUBA1B, TUBA1A, TUBA1C	TUBA1B, TUBA1B-AS1			ENSG00000123416, ENSG00000258017			rs1057548-?	rs1057548	0	1057548	missense_variant	0	NR	8E-10	9.096910013008056				NR [7428630] (imputed)	N	brain attribute, neuroimaging measurement	http://purl.obolibrary.org/obo/OBA_2045210, http://www.ebi.ac.uk/efo/EFO_0004346	GCST010703	Genome-wide genotyping array
2022-11-23	35164939	van der Meer D	2022-02-11	Biol Psychiatry	www.ncbi.nlm.nih.gov/pubmed/35164939	Boosting Schizophrenia Genetics by Utilizing Genetic Overlap With Brain Morphology.	Brain morphology (MOSTest)	33,735 white British ancestry individuals	NA	12q13.12	12	49128822		TUBA1B, TUBA1B-AS1			ENSG00000123416, ENSG00000258017			rs1057548-?	rs1057548	0	1057548	missense_variant	0	NR	5E-15	14.301029995663981				NR [9061072] (imputed)	N	neuroimaging measurement	http://www.ebi.ac.uk/efo/EFO_0004346	GCST90239729	Genome-wide genotyping array
2023-02-23	36800424	Sha Z	2023-02-17	Sci Adv	www.ncbi.nlm.nih.gov/pubmed/36800424	Genetic architecture of the white matter connectome of the human brain.	Edge-level brain connectivity (multivariate analysis)	30,810 British ancestry individuals	NA	12q13.12	12	49127889		TUBA1B, TUBA1B-AS1			ENSG00000123416, ENSG00000258017			rs2753-G	rs2753	0	2753	3_prime_UTR_variant	0	0.65813	5E-10	9.301029995663981		6.2093563	z score increase	NR [9312361] (imputed)	N	brain connectivity attribute	http://purl.obolibrary.org/obo/OBA_2045295	GCST90165318	Genome-wide genotyping array
2022-03-07	34910505	van der Meer D	2021-12-15	Sci Adv	www.ncbi.nlm.nih.gov/pubmed/34910505	The genetic architecture of human cortical folding.	Vertex-wise cortical thickness	33,748 European ancestry individuals	NA	12q13.12	12	49175216		TUBA1B-AS1			ENSG00000258017			rs10875930-G	rs10875930	0	10875930	intron_variant	0	0.34	1E-13	13.0		7.41	z score increase	Affymetrix [9061022] (imputed)	N	cortical thickness	http://www.ebi.ac.uk/efo/EFO_0004840	GCST90095131	Genome-wide genotyping array
2022-08-05	35835914	Watanabe K	2022-07-14	Nat Genet	www.ncbi.nlm.nih.gov/pubmed/35835914	Genome-wide meta-analysis of insomnia prioritizes genes associated with metabolic and psychiatric pathways.	Insomnia	593,724 European ancestry cases, 1,771,286 European ancestry controls	NA	12q13.12	12	49118977		LMBR1L - TUBA1B	ENSG00000139636	ENSG00000123416		8077	8805	rs12228775-T	rs12228775	0	12228775	intergenic_variant	1	NR	4E-8	7.3979400086720375		0.005	[0.003-0.007] unit decrease	Illumina [10713943] (imputed)	N	insomnia	http://www.ebi.ac.uk/efo/EFO_0004698	GCST90131901	Genome-wide genotyping array
2021-12-15	34560273	Shadrin AA	2021-09-21	Neuroimage	www.ncbi.nlm.nih.gov/pubmed/34560273	Vertex-wise multivariate genome-wide association study identifies 780 unique genetic loci associated with cortical morphology.	Cortical thickness	35,657 White British ancestry individuals	NA	12q13.12	12	49163105	NR	TUBA1B-AS1			ENSG00000258017			rs58336603-T	rs58336603	0	58336603	intron_variant	0	0.3395	3E-13	12.522878745280337				NR [9056863] (imputed)	N	cortical thickness	http://www.ebi.ac.uk/efo/EFO_0004840	GCST90091061	Genome-wide genotyping array
2022-04-25	35393526	Montasser ME	2022-04-07	Commun Biol	www.ncbi.nlm.nih.gov/pubmed/35393526	An Amish founder population reveals rare-population genetic determinants of the human lipidome.	Sphingomyelin (d32:2) levels	650 Amish individuals	847 European American ancestry individuals	12q13.12	12	49162179		TUBA1B-AS1			ENSG00000258017			rs35851347-A	rs35851347	0	35851347	intron_variant	0	0.05086	2E-9	8.698970004336019	(Amish)	0.81745046	unit decrease	Affymetrix [7917357] (imputed)	N	sphingomyelin measurement	http://www.ebi.ac.uk/efo/EFO_0010118	GCST90094889	Genome-wide genotyping array
2021-01-26	32376654	Richardson TG	2020-05-06	BMJ	www.ncbi.nlm.nih.gov/pubmed/32376654	Use of genetic variation to separate the effects of early and later life adiposity on disease risk: mendelian randomisation study.	Body size at age 10	453,169 European ancestry individuals	NA	12q13.12	12	49115479	LMBR1L	LMBR1L - TUBA1B	ENSG00000139636	ENSG00000123416		4579	12303	rs7958241-A	rs7958241	0	7958241	intergenic_variant	1	0.656021	9E-19	18.045757490560675		0.0130618	[0.01-0.016] unit decrease	Affymetrix [12370749]	N	comparative body size at age 10, self-reported	http://www.ebi.ac.uk/efo/EFO_0009819	GCST010989	Genome-wide genotyping array
2025-01-06	39024449	Verma A	2024-07-19	Science	www.ncbi.nlm.nih.gov/pubmed/39024449	Diversity and scale: Genetic architecture of 2068 traits in the VA Million Veteran Program.	heart rate (HR, mean, inv-normal transformed)	119,336 African American or Afro-Caribbean individuals, 57,990 Hispanic or Latin American individuals, 6,421 East Asian ancestry individuals, 425,748 European ancestry individuals	NA	12q13.12	12	49169483		TUBA1B-AS1			ENSG00000258017			rs6580702-A	rs6580702	0	6580702	intron_variant	0	0.6579	4E-11	10.397940008672037		0.01857	[0.013-0.024] unit increase	NR [44300000] (imputed)	N	heart rate	http://purl.obolibrary.org/obo/OBA_1001087	GCST90480666	Genome-wide genotyping array
2022-08-04	35505052	Fan CC	2022-05-03	Nat Commun	www.ncbi.nlm.nih.gov/pubmed/35505052	Multivariate genome-wide association study on tissue-sensitive diffusion metrics highlights pathways that shape the human brain.	Whole brain restricted directional diffusion (multivariate analysis)	23,543 European ancestry individuals	11,555 European ancestry individuals, 3,030 non-European ancestry individuals	12q13.12	12	49115479		LMBR1L - TUBA1B	ENSG00000139636	ENSG00000123416		4579	12303	rs7958241-?	rs7958241	0	7958241	intergenic_variant	1	NR	4E-9	8.397940008672037	(EA)			NR [NR] (imputed)	N	brain attribute	http://purl.obolibrary.org/obo/OBA_2045210	GCST90131905	Genome-wide genotyping array
2021-01-09	32989287	Cuellar-Partida G	2020-09-28	Nat Hum Behav	www.ncbi.nlm.nih.gov/pubmed/32989287	Genome-wide association study identifies 48 common genetic variants associated with handedness.	Left-handedness	1,766,671 European ancestry individuals	NA	12q13.12	12	49146109	TUBA1B	TUBA1B-AS1			ENSG00000258017			rs11168884-T	rs11168884	0	11168884	intron_variant	0	0.343	2E-10	9.698970004336019		0.98080784	[NR]	Illumina [12493444] (imputed)	N	handedness	http://www.ebi.ac.uk/efo/EFO_0009902	GCST90013421	Genome-wide genotyping array
2021-01-09	32989287	Cuellar-Partida G	2020-09-28	Nat Hum Behav	www.ncbi.nlm.nih.gov/pubmed/32989287	Genome-wide association study identifies 48 common genetic variants associated with handedness.	Ambidextrousness	47,637 European ancestry cases, 1,422,823 European ancestry controls	NA	12q13.12	12	49136349	TUBA1B	TUBA1B-AS1			ENSG00000258017			rs35554786-D	rs35554786	0	35554786	intron_variant	0	0.24	1E-9	9.0		0.93389755	[NR]	Illumina [12493443] (imputed)	N	handedness	http://www.ebi.ac.uk/efo/EFO_0009902	GCST90013420	Genome-wide genotyping array
2021-03-30	33723403	Sha Z	2021-03-15	Nat Hum Behav	www.ncbi.nlm.nih.gov/pubmed/33723403	The genetic architecture of structural left-right asymmetry of the human brain.	Left–right brain asymmetry	32,256 European ancestry individuals	NA	12q13.12	12	49123163	TUBA1B	LMBR1L - TUBA1B	ENSG00000139636	ENSG00000123416		12263	4619	rs10783306-C	rs10783306	0	10783306	intergenic_variant	1	0.33	1E-11	11.0				NR [9312144] (imputed)	N	brain attribute	http://purl.obolibrary.org/obo/OBA_2045210	GCST90010427	Genome-wide genotyping array
2022-09-01	31882771	Al-Khelaifi F	2019-12-27	Sci Rep	www.ncbi.nlm.nih.gov/pubmed/31882771	Metabolic GWAS of elite athletes reveals novel genetically-influenced metabolites associated with athletic performance.	1-palmitoyl-2-linoleoyl-GPE (16:0/18:2) levels in elite athletes	490 individuals	NA	12q13.12	12	49184799		TUBA1A, TUBA1B-AS1			ENSG00000167552, ENSG00000258017			rs140121590-?	rs140121590	0	140121590	3_prime_UTR_variant	0	NR	7E-6	5.154901959985743		0.9424406	[0.53-1.35] unit increase	Illumina [275016]	N	lipid measurement	http://www.ebi.ac.uk/efo/EFO_0004529	GCST90133722	Genome-wide genotyping array
